<?xml version="1.0" encoding="UTF-8"?>
<MarkovProcess xmlns:xsi="http://www.w3.org/2001/XMLSchema-instance" xsi:noNamespaceSchemaLocation="E:\Users\goorrob\My Documents\DEV\internal\osiris\OsirisXML\MarkovProcess.xsd">
	<MarkovState>
		<Value>0</Value>
		<MarkovTransition>
			<ToState>0</ToState>
			<Frequency>22.</Frequency>
		</MarkovTransition>
		<MarkovTransition>
			<ToState>1</ToState>
			<Frequency>10</Frequency>
		</MarkovTransition>
		<MarkovTransition>
			<ToState>2</ToState>
			<Frequency>2</Frequency>
		</MarkovTransition>
		<MarkovTransition>
			<ToState>-1</ToState>
			<Frequency>5</Frequency>
		</MarkovTransition>
		<MarkovTransition>
			<ToState>-2</ToState>
			<Frequency>1</Frequency>
		</MarkovTransition>
	</MarkovState>
	<MarkovState>
		<Value>1</Value>
		<MarkovTransition>
			<ToState>1</ToState>
			<Frequency>6</Frequency>
		</MarkovTransition>
		<MarkovTransition>
			<ToState>2</ToState>
			<Frequency>13</Frequency>
		</MarkovTransition>
		<MarkovTransition>
			<ToState>3</ToState>
			<Frequency>3</Frequency>
		</MarkovTransition>
		<MarkovTransition>
			<ToState>4</ToState>
			<Frequency>1</Frequency>
		</MarkovTransition>
		<MarkovTransition>
			<ToState>0</ToState>
			<Frequency>9</Frequency>
		</MarkovTransition>
		<MarkovTransition>
			<ToState>-1</ToState>
			<Frequency>1</Frequency>
		</MarkovTransition>
	</MarkovState>
	<MarkovState>
		<Value>2</Value>
		<MarkovTransition>
			<ToState>2</ToState>
			<Frequency>12</Frequency>
		</MarkovTransition>
		<MarkovTransition>
			<ToState>3</ToState>
			<Frequency>14</Frequency>
		</MarkovTransition>
		<MarkovTransition>
			<ToState>4</ToState>
			<Frequency>1</Frequency>
		</MarkovTransition>
		<MarkovTransition>
			<ToState>5</ToState>
			<Frequency>1</Frequency>
		</MarkovTransition>
		<MarkovTransition>
			<ToState>1</ToState>
			<Frequency>10</Frequency>
		</MarkovTransition>
		<MarkovTransition>
			<ToState>0</ToState>
			<Frequency>2</Frequency>
		</MarkovTransition>
	</MarkovState>
	<MarkovState>
		<Value>3</Value>
		<MarkovTransition>
			<ToState>3</ToState>
			<Frequency>20</Frequency>
		</MarkovTransition>
		<MarkovTransition>
			<ToState>4</ToState>
			<Frequency>12</Frequency>
		</MarkovTransition>
		<MarkovTransition>
			<ToState>5</ToState>
			<Frequency>1</Frequency>
		</MarkovTransition>
		<MarkovTransition>
			<ToState>6</ToState>
			<Frequency>1</Frequency>
		</MarkovTransition>
		<MarkovTransition>
			<ToState>2</ToState>
			<Frequency>11</Frequency>
		</MarkovTransition>
		<MarkovTransition>
			<ToState>1</ToState>
			<Frequency>3</Frequency>
		</MarkovTransition>
		<MarkovTransition>
			<ToState>0</ToState>
			<Frequency>1</Frequency>
		</MarkovTransition>
	</MarkovState>
	<MarkovState>
		<Value>4</Value>
		<MarkovTransition>
			<ToState>4</ToState>
			<Frequency>14</Frequency>
		</MarkovTransition>
		<MarkovTransition>
			<ToState>5</ToState>
			<Frequency>12</Frequency>
		</MarkovTransition>
		<MarkovTransition>
			<ToState>6</ToState>
			<Frequency>3</Frequency>
		</MarkovTransition>
		<MarkovTransition>
			<ToState>3</ToState>
			<Frequency>12</Frequency>
		</MarkovTransition>
		<MarkovTransition>
			<ToState>2</ToState>
			<Frequency>2</Frequency>
		</MarkovTransition>
	</MarkovState>
	<MarkovState>
		<Value>5</Value>
		<MarkovTransition>
			<ToState>5</ToState>
			<Frequency>12</Frequency>
		</MarkovTransition>
		<MarkovTransition>
			<ToState>6</ToState>
			<Frequency>7</Frequency>
		</MarkovTransition>
		<MarkovTransition>
			<ToState>7</ToState>
			<Frequency>2</Frequency>
		</MarkovTransition>
		<MarkovTransition>
			<ToState>4</ToState>
			<Frequency>11</Frequency>
		</MarkovTransition>
		<MarkovTransition>
			<ToState>3</ToState>
			<Frequency>1</Frequency>
		</MarkovTransition>
		<MarkovTransition>
			<ToState>2</ToState>
			<Frequency>1</Frequency>
		</MarkovTransition>
	</MarkovState>
	<MarkovState>
		<Value>6</Value>
		<MarkovTransition>
			<ToState>6</ToState>
			<Frequency>4</Frequency>
		</MarkovTransition>
		<MarkovTransition>
			<ToState>7</ToState>
			<Frequency>4</Frequency>
		</MarkovTransition>
		<MarkovTransition>
			<ToState>8</ToState>
			<Frequency>4</Frequency>
		</MarkovTransition>
		<MarkovTransition>
			<ToState>5</ToState>
			<Frequency>7</Frequency>
		</MarkovTransition>
		<MarkovTransition>
			<ToState>4</ToState>
			<Frequency>5</Frequency>
		</MarkovTransition>
	</MarkovState>
	<MarkovState>
		<Value>7</Value>
		<MarkovTransition>
			<ToState>7</ToState>
			<Frequency>1</Frequency>
		</MarkovTransition>
		<MarkovTransition>
			<ToState>8</ToState>
			<Frequency>2</Frequency>
		</MarkovTransition>
		<MarkovTransition>
			<ToState>9</ToState>
			<Frequency>1</Frequency>
		</MarkovTransition>
		<MarkovTransition>
			<ToState>6</ToState>
			<Frequency>8</Frequency>
		</MarkovTransition>
		<MarkovTransition>
			<ToState>5</ToState>
			<Frequency>2</Frequency>
		</MarkovTransition>
	</MarkovState>
	<MarkovState>
		<Value>8</Value>
		<MarkovTransition>
			<ToState>8</ToState>
			<Frequency>4</Frequency>
		</MarkovTransition>
		<MarkovTransition>
			<ToState>9</ToState>
			<Frequency>2</Frequency>
		</MarkovTransition>
		<MarkovTransition>
			<ToState>10</ToState>
			<Frequency>1</Frequency>
		</MarkovTransition>
		<MarkovTransition>
			<ToState>7</ToState>
			<Frequency>6</Frequency>
		</MarkovTransition>
		<MarkovTransition>
			<ToState>6</ToState>
			<Frequency>1</Frequency>
		</MarkovTransition>
	</MarkovState>
	<MarkovState>
		<Value>9</Value>
		<MarkovTransition>
			<ToState>9</ToState>
			<Frequency>2</Frequency>
		</MarkovTransition>
		<MarkovTransition>
			<ToState>10</ToState>
			<Frequency>1</Frequency>
		</MarkovTransition>
		<MarkovTransition>
			<ToState>8</ToState>
			<Frequency>4</Frequency>
		</MarkovTransition>
	</MarkovState>
	<MarkovState>
		<Value>10</Value>
		<MarkovTransition>
			<ToState>10</ToState>
			<Frequency>1</Frequency>
		</MarkovTransition>
		<MarkovTransition>
			<ToState>11</ToState>
			<Frequency>1</Frequency>
		</MarkovTransition>
		<MarkovTransition>
			<ToState>9</ToState>
			<Frequency>1</Frequency>
		</MarkovTransition>
	</MarkovState>
	<MarkovState>
		<Value>11</Value>
		<MarkovTransition>
			<ToState>12</ToState>
			<Frequency>1</Frequency>
		</MarkovTransition>
		<MarkovTransition>
			<ToState>10</ToState>
			<Frequency>1</Frequency>
		</MarkovTransition>
	</MarkovState>
	<MarkovState>
		<Value>12</Value>
		<MarkovTransition>
			<ToState>11</ToState>
			<Frequency>1</Frequency>
		</MarkovTransition>
	</MarkovState>
	<MarkovState>
		<Value>-1</Value>
		<MarkovTransition>
			<ToState>-1</ToState>
			<Frequency>2</Frequency>
		</MarkovTransition>
		<MarkovTransition>
			<ToState>0</ToState>
			<Frequency>5</Frequency>
		</MarkovTransition>
		<MarkovTransition>
			<ToState>1</ToState>
			<Frequency>2</Frequency>
		</MarkovTransition>
		<MarkovTransition>
			<ToState>-2</ToState>
			<Frequency>3</Frequency>
		</MarkovTransition>
	</MarkovState>
	<MarkovState>
		<Value>-2</Value>
		<MarkovTransition>
			<ToState>-2</ToState>
			<Frequency>1</Frequency>
		</MarkovTransition>
		<MarkovTransition>
			<ToState>-1</ToState>
			<Frequency>2</Frequency>
		</MarkovTransition>
		<MarkovTransition>
			<ToState>0</ToState>
			<Frequency>1</Frequency>
		</MarkovTransition>
		<MarkovTransition>
			<ToState>-3</ToState>
			<Frequency>2</Frequency>
		</MarkovTransition>
	</MarkovState>
	<MarkovState>
		<Value>-3</Value>
		<MarkovTransition>
			<ToState>-2</ToState>
			<Frequency>2</Frequency>
		</MarkovTransition>
	</MarkovState>
</MarkovProcess>
